{
  "schema_version": 1,
  "ledger_id": "keth_shipyards_source_ledger",
  "frame_numbering": "zero_based_decoded_frame",
  "sources": [
    {
      "id": "A1",
      "tier": "A",
      "title": "Keth Shipyards [Fixed]",
      "source_type": "roblox_experience_page",
      "artifacts": [
        {"artifact_id": "A1.1", "relation": "canonical", "url": "https://www.roblox.com/games/9287346/Keth-Shipyards-Fixed", "accessed_on": "2026-08-12", "archive_status": "live_endpoint"}
      ],
      "parties": [{"role": "creator", "display_name": "ZolarKeth", "stable_id": "2629700"}],
      "date_events": [{"kind": "page_updated", "value": "2017-05-21", "status": "documented"}],
      "rendition": null,
      "anchors": [],
      "claims_supported": ["facility.deep_space_construction_and_storage", "controls.fixed_era_y_x_h_f_g"],
      "limitations": ["Current volatile page describes the repaired/fixed era and must not be projected to the 2009 launch build."],
      "rights": {"license": null, "permission_status": "permission_not_recorded", "redistribution_policy": "do_not_bundle_or_commit", "allowed_project_policy": "citation_and_limited_internal_study_only"},
      "repo_references": ["RESEARCH.md#tier-a-primary-and-official"]
    },
    {
      "id": "A2",
      "tier": "A",
      "title": "Official place and universe identity metadata",
      "source_type": "roblox_api_bundle",
      "artifacts": [
        {"artifact_id": "A2.1", "relation": "metadata", "url": "https://apis.roblox.com/universes/v1/places/9287346/universe", "accessed_on": "2026-08-12", "archive_status": "live_endpoint"},
        {"artifact_id": "A2.2", "relation": "metadata", "url": "https://games.roblox.com/v1/games?universeIds=17657420", "accessed_on": "2026-08-12", "archive_status": "live_endpoint"}
      ],
      "parties": [{"role": "creator", "display_name": "ZolarKeth", "stable_id": "2629700"}],
      "date_events": [
        {"kind": "page_created", "value": "2009-03-28", "status": "documented"},
        {"kind": "page_updated", "value": "2017-05-21", "status": "documented"}
      ],
      "rendition": null,
      "anchors": [],
      "claims_supported": ["identity.place_9287346_universe_17657420_creator_2629700", "metadata.copying_allowed_false"],
      "limitations": ["No canonical response bytes are tracked. copyingAllowed:false is API metadata, not a copyright licence."],
      "rights": {"license": null, "permission_status": "permission_not_recorded", "redistribution_policy": "do_not_bundle_or_commit", "allowed_project_policy": "citation_and_limited_internal_study_only"},
      "repo_references": ["RESEARCH.md#version-boundaries"]
    },
    {
      "id": "A3",
      "tier": "A",
      "title": "Archived official page, 2009-11-12",
      "source_type": "wayback_snapshot",
      "artifacts": [
        {"artifact_id": "A3.1", "relation": "archive", "url": "https://web.archive.org/web/20091112091226/http://www.roblox.com/Item.aspx?ID=9287346", "accessed_on": "2026-08-12", "archive_status": "canonical_archive"}
      ],
      "parties": [{"role": "page_author_and_creator", "display_name": "ZolarKeth", "stable_id": "2629700"}],
      "date_events": [{"kind": "archive_captured", "value": "2009-11-12T09:12:26Z", "status": "documented"}],
      "rendition": null,
      "anchors": [],
      "claims_supported": ["fleet.original_ten_name_role_roster", "controls.2009_y_x_h_f_d", "lifecycle.chat_regeneration_cleanup_vote", "history.corona_removed_command_section_proposed"],
      "limitations": ["Snapshot proves its dated page contents, not a timeless roster or exact station plan."],
      "rights": {"license": null, "permission_status": "permission_not_recorded", "redistribution_policy": "do_not_bundle_or_commit", "allowed_project_policy": "citation_and_limited_internal_study_only"},
      "repo_references": ["RESEARCH.md#best-creator-authored-original-roster-2009-11-12"]
    },
    {
      "id": "A4",
      "tier": "A",
      "title": "Archived official page, 2010-01-09",
      "source_type": "wayback_snapshot",
      "artifacts": [
        {"artifact_id": "A4.1", "relation": "archive", "url": "https://web.archive.org/web/20100109100101/http://www.roblox.com/Item.aspx?ID=9287346", "accessed_on": "2026-08-12", "archive_status": "canonical_archive"}
      ],
      "parties": [{"role": "page_author_and_creator", "display_name": "ZolarKeth", "stable_id": "2629700"}],
      "date_events": [{"kind": "archive_captured", "value": "2010-01-09T10:01:01Z", "status": "documented"}],
      "rendition": null,
      "anchors": [],
      "claims_supported": ["fleet.salyut_arrived_twelve_completed", "controls.land_hover_variant", "activity.explorer_and_vip_badges"],
      "limitations": ["The page does not enumerate the second addition needed to reconcile the twelve-ship count."],
      "rights": {"license": null, "permission_status": "permission_not_recorded", "redistribution_policy": "do_not_bundle_or_commit", "allowed_project_policy": "citation_and_limited_internal_study_only"},
      "repo_references": ["RESEARCH.md#later-additions-and-count-changes"]
    },
    {
      "id": "A5",
      "tier": "A",
      "title": "Archived official page updated 2010-01-28",
      "source_type": "wayback_snapshot",
      "artifacts": [
        {"artifact_id": "A5.1", "relation": "archive", "url": "https://web.archive.org/web/20100205194948/http://www.roblox.com/Item.aspx?ID=9287346", "accessed_on": "2026-08-12", "archive_status": "canonical_archive"}
      ],
      "parties": [{"role": "page_author_and_creator", "display_name": "ZolarKeth", "stable_id": "2629700"}],
      "date_events": [
        {"kind": "archive_captured", "value": "2010-02-05T19:49:48Z", "status": "documented"},
        {"kind": "page_updated", "value": "2010-01-28", "status": "page_claim"}
      ],
      "rendition": null,
      "anchors": [],
      "claims_supported": ["fleet.zenith_vip_interceptor", "lifecycle.piloted_vehicle_removed_on_pilot_death", "fleet.twelve_completed"],
      "limitations": ["The archive capture date and the page-reported update date are distinct events."],
      "rights": {"license": null, "permission_status": "permission_not_recorded", "redistribution_policy": "do_not_bundle_or_commit", "allowed_project_policy": "citation_and_limited_internal_study_only"},
      "repo_references": ["RESEARCH.md#later-additions-and-count-changes"]
    },
    {
      "id": "A6",
      "tier": "A",
      "title": "Archived official page, 2010-11-30",
      "source_type": "wayback_snapshot",
      "artifacts": [
        {"artifact_id": "A6.1", "relation": "archive", "url": "https://web.archive.org/web/20101130043701/http://www.roblox.com/Keth-Shipyards-item?id=9287346", "accessed_on": "2026-08-12", "archive_status": "canonical_archive"}
      ],
      "parties": [{"role": "page_author_and_creator", "display_name": "ZolarKeth", "stable_id": "2629700"}],
      "date_events": [{"kind": "archive_captured", "value": "2010-11-30T04:37:01Z", "status": "documented"}],
      "rendition": null,
      "anchors": [],
      "claims_supported": ["fleet.eleven_completed", "controls.d_undock_y_x_h_f", "lifecycle.chat_regeneration"],
      "limitations": ["This dated control snapshot conflicts with earlier uses of D and X; it is not a timeless key map."],
      "rights": {"license": null, "permission_status": "permission_not_recorded", "redistribution_policy": "do_not_bundle_or_commit", "allowed_project_policy": "citation_and_limited_internal_study_only"},
      "repo_references": ["RESEARCH.md#documented-control-history"]
    },
    {
      "id": "A7",
      "tier": "A",
      "title": "Archived official page, 2015-12-08",
      "source_type": "wayback_snapshot",
      "artifacts": [
        {"artifact_id": "A7.1", "relation": "archive", "url": "https://web.archive.org/web/20151208133335/http://www.roblox.com/games/9287346/Keth-Shipyards", "accessed_on": "2026-08-12", "archive_status": "canonical_archive"}
      ],
      "parties": [{"role": "page_author_and_creator", "display_name": "ZolarKeth", "stable_id": "2629700"}],
      "date_events": [{"kind": "archive_captured", "value": "2015-12-08T13:33:35Z", "status": "documented"}],
      "rendition": null,
      "anchors": [],
      "claims_supported": ["controls.repaired_era_g_barrel_roll"],
      "limitations": ["This is repaired-era control evidence, not proof of a 2009 binding."],
      "rights": {"license": null, "permission_status": "permission_not_recorded", "redistribution_policy": "do_not_bundle_or_commit", "allowed_project_policy": "citation_and_limited_internal_study_only"},
      "repo_references": ["RESEARCH.md#documented-control-history"]
    },
    {
      "id": "A8",
      "tier": "A",
      "title": "Official 2017 experience media",
      "source_type": "roblox_media_bundle",
      "artifacts": [
        {"artifact_id": "A8.1", "relation": "metadata", "url": "https://games.roblox.com/v2/games/17657420/media", "accessed_on": "2026-08-12", "archive_status": "live_endpoint"},
        {"artifact_id": "A8.2", "relation": "metadata", "url": "https://economy.roblox.com/v2/assets/672638117/details", "accessed_on": "2026-08-12", "archive_status": "live_endpoint"},
        {"artifact_id": "A8.3", "relation": "media", "url": "https://thumbnails.roblox.com/v1/games/multiget/thumbnails?universeIds=17657420&countPerUniverse=10&defaults=true&size=768x432&format=Png&isCircular=false", "accessed_on": "2026-08-12", "archive_status": "live_endpoint"}
      ],
      "parties": [{"role": "asset_creator", "display_name": "ZolarKeth", "stable_id": "2629700"}],
      "date_events": [{"kind": "asset_created", "value": "2017-02-27", "status": "documented"}],
      "rendition": null,
      "anchors": [],
      "claims_supported": ["station.fixed_build_asymmetric_dock_lattice", "fleet.fixed_build_multiple_parked_craft", "palette.dark_space_simple_coloured_bodies"],